{
  "$schema": "https://json-schema.org/draft/2020-12/schema",
  "$id": "genesis.packet-index.v1",
  "title": "GENESIS packet index",
  "description": "Hash-bound pointer list of every packets/<id>.json in this repository. The index is not the contract — each packet file is. Maintained by whoever merges a packet change. Shape is the one packets/INDEX.json already uses: a named schema, a description, an updatedAt timestamp, and an array of {id, status, path, sha256} entries whose sha256 is 64 lowercase hex characters.",
  "type": "object",
  "additionalProperties": false,
  "required": ["schema", "description", "updatedAt", "packets"],
  "properties": {
    "schema": { "const": "genesis.packet-index.v1" },
    "description": {
      "type": "string",
      "minLength": 1,
      "description": "What this index is for, in plain language. Not a second copy of the packets."
    },
    "updatedAt": {
      "type": "string",
      "format": "date-time",
      "description": "When this index file was last rewritten to match the packet files it lists."
    },
    "packets": {
      "type": "array",
      "items": { "$ref": "#/$defs/entry" }
    }
  },
  "$defs": {
    "entry": {
      "type": "object",
      "additionalProperties": false,
      "required": ["id", "status", "path", "sha256"],
      "description": "One row. id, status, and path must match the on-disk packet; sha256 is the hash of that file's exact bytes.",
      "properties": {
        "id": { "type": "string", "minLength": 1 },
        "status": { "type": "string", "minLength": 1 },
        "path": { "type": "string", "minLength": 1 },
        "sha256": {
          "type": "string",
          "pattern": "^[a-f0-9]{64}$",
          "description": "SHA-256 of the packet file bytes, 64 lowercase hex characters."
        }
      }
    }
  }
}
